[
  {
    "id": "sofa",
    "label": "Sofa",
    "group": "Seating",
    "support": "floor",
    "defaultSize": {
      "w": 2.1,
      "d": 0.92,
      "h": 0.83
    },
    "mountHeight": null,
    "materialSlots": [
      "upholstery",
      "legs"
    ],
    "faceSlot": null,
    "collisionExempt": false,
    "detectionPrompts": [
      "sofa",
      "couch",
      "settee"
    ]
  },
  {
    "id": "sectional",
    "label": "Sectional",
    "group": "Seating",
    "support": "floor",
    "defaultSize": {
      "w": 2.6,
      "d": 1.8,
      "h": 0.84
    },
    "mountHeight": null,
    "materialSlots": [
      "upholstery",
      "legs"
    ],
    "faceSlot": null,
    "collisionExempt": false,
    "detectionPrompts": [
      "sectional",
      "l-shaped sofa",
      "corner sofa"
    ]
  },
  {
    "id": "loveseat",
    "label": "Loveseat",
    "group": "Seating",
    "support": "floor",
    "defaultSize": {
      "w": 1.5,
      "d": 0.9,
      "h": 0.83
    },
    "mountHeight": null,
    "materialSlots": [
      "upholstery",
      "legs"
    ],
    "faceSlot": null,
    "collisionExempt": false,
    "detectionPrompts": [
      "loveseat",
      "two-seat sofa"
    ]
  },
  {
    "id": "armchair",
    "label": "Armchair",
    "group": "Seating",
    "support": "floor",
    "defaultSize": {
      "w": 0.85,
      "d": 0.88,
      "h": 0.8
    },
    "mountHeight": null,
    "materialSlots": [
      "upholstery",
      "legs"
    ],
    "faceSlot": null,
    "collisionExempt": false,
    "detectionPrompts": [
      "armchair"
    ]
  },
  {
    "id": "accent-chair",
    "label": "Accent Chair",
    "group": "Seating",
    "support": "floor",
    "defaultSize": {
      "w": 0.7,
      "d": 0.72,
      "h": 0.85
    },
    "mountHeight": null,
    "materialSlots": [
      "upholstery",
      "legs"
    ],
    "faceSlot": null,
    "collisionExempt": false,
    "detectionPrompts": [
      "accent chair"
    ]
  },
  {
    "id": "recliner",
    "label": "Recliner",
    "group": "Seating",
    "support": "floor",
    "defaultSize": {
      "w": 0.9,
      "d": 0.95,
      "h": 1.05
    },
    "mountHeight": null,
    "materialSlots": [
      "upholstery",
      "base"
    ],
    "faceSlot": null,
    "collisionExempt": false,
    "detectionPrompts": [
      "recliner"
    ]
  },
  {
    "id": "dining-chair",
    "label": "Dining Chair",
    "group": "Seating",
    "support": "floor",
    "defaultSize": {
      "w": 0.46,
      "d": 0.52,
      "h": 0.9
    },
    "mountHeight": null,
    "materialSlots": [
      "seat",
      "frame"
    ],
    "faceSlot": null,
    "collisionExempt": false,
    "detectionPrompts": [
      "dining chair"
    ]
  },
  {
    "id": "office-chair",
    "label": "Office Chair",
    "group": "Seating",
    "support": "floor",
    "defaultSize": {
      "w": 0.65,
      "d": 0.65,
      "h": 1.1
    },
    "mountHeight": null,
    "materialSlots": [
      "upholstery",
      "base"
    ],
    "faceSlot": null,
    "collisionExempt": false,
    "detectionPrompts": [
      "office chair",
      "desk chair",
      "task chair"
    ]
  },
  {
    "id": "rocking-chair",
    "label": "Rocking Chair",
    "group": "Seating",
    "support": "floor",
    "defaultSize": {
      "w": 0.65,
      "d": 0.9,
      "h": 1.05
    },
    "mountHeight": null,
    "materialSlots": [
      "seat",
      "frame"
    ],
    "faceSlot": null,
    "collisionExempt": false,
    "detectionPrompts": [
      "rocking chair"
    ]
  },
  {
    "id": "folding-chair",
    "label": "Folding Chair",
    "group": "Seating",
    "support": "floor",
    "defaultSize": {
      "w": 0.45,
      "d": 0.5,
      "h": 0.85
    },
    "mountHeight": null,
    "materialSlots": [
      "seat",
      "frame"
    ],
    "faceSlot": null,
    "collisionExempt": false,
    "detectionPrompts": [
      "folding chair"
    ]
  },
  {
    "id": "stool",
    "label": "Stool",
    "group": "Seating",
    "support": "floor",
    "defaultSize": {
      "w": 0.36,
      "d": 0.36,
      "h": 0.45
    },
    "mountHeight": null,
    "materialSlots": [
      "seat",
      "legs"
    ],
    "faceSlot": null,
    "collisionExempt": false,
    "detectionPrompts": [
      "stool"
    ]
  },
  {
    "id": "bar-stool",
    "label": "Bar Stool",
    "group": "Seating",
    "support": "floor",
    "defaultSize": {
      "w": 0.4,
      "d": 0.4,
      "h": 0.75
    },
    "mountHeight": null,
    "materialSlots": [
      "seat",
      "legs"
    ],
    "faceSlot": null,
    "collisionExempt": false,
    "detectionPrompts": [
      "bar stool",
      "counter stool"
    ]
  },
  {
    "id": "bench",
    "label": "Bench",
    "group": "Seating",
    "support": "floor",
    "defaultSize": {
      "w": 1.2,
      "d": 0.4,
      "h": 0.45
    },
    "mountHeight": null,
    "materialSlots": [
      "seat",
      "legs"
    ],
    "faceSlot": null,
    "collisionExempt": false,
    "detectionPrompts": [
      "bench"
    ]
  },
  {
    "id": "ottoman",
    "label": "Ottoman",
    "group": "Seating",
    "support": "floor",
    "defaultSize": {
      "w": 0.7,
      "d": 0.7,
      "h": 0.42
    },
    "mountHeight": null,
    "materialSlots": [
      "upholstery",
      "legs"
    ],
    "faceSlot": null,
    "collisionExempt": false,
    "detectionPrompts": [
      "ottoman",
      "footstool",
      "footrest"
    ]
  },
  {
    "id": "pouf",
    "label": "Pouf",
    "group": "Seating",
    "support": "floor",
    "defaultSize": {
      "w": 0.55,
      "d": 0.55,
      "h": 0.4
    },
    "mountHeight": null,
    "materialSlots": [
      "upholstery"
    ],
    "faceSlot": null,
    "collisionExempt": false,
    "detectionPrompts": [
      "pouf"
    ]
  },
  {
    "id": "chaise-lounge",
    "label": "Chaise Lounge",
    "group": "Seating",
    "support": "floor",
    "defaultSize": {
      "w": 0.8,
      "d": 1.65,
      "h": 0.8
    },
    "mountHeight": null,
    "materialSlots": [
      "upholstery",
      "legs"
    ],
    "faceSlot": null,
    "collisionExempt": false,
    "detectionPrompts": [
      "chaise lounge"
    ]
  },
  {
    "id": "beanbag",
    "label": "Beanbag",
    "group": "Seating",
    "support": "floor",
    "defaultSize": {
      "w": 0.9,
      "d": 0.9,
      "h": 0.7
    },
    "mountHeight": null,
    "materialSlots": [
      "upholstery"
    ],
    "faceSlot": null,
    "collisionExempt": false,
    "detectionPrompts": [
      "beanbag",
      "bean bag chair"
    ]
  },
  {
    "id": "floor-cushion",
    "label": "Floor Cushion",
    "group": "Seating",
    "support": "floor",
    "defaultSize": {
      "w": 0.6,
      "d": 0.6,
      "h": 0.15
    },
    "mountHeight": null,
    "materialSlots": [
      "upholstery"
    ],
    "faceSlot": null,
    "collisionExempt": true,
    "detectionPrompts": [
      "floor cushion"
    ]
  },
  {
    "id": "coffee-table",
    "label": "Coffee Table",
    "group": "Tables & Desks",
    "support": "floor",
    "defaultSize": {
      "w": 1.2,
      "d": 0.6,
      "h": 0.42
    },
    "mountHeight": null,
    "materialSlots": [
      "top",
      "legs"
    ],
    "faceSlot": null,
    "collisionExempt": false,
    "detectionPrompts": [
      "coffee table"
    ]
  },
  {
    "id": "side-table",
    "label": "Side Table",
    "group": "Tables & Desks",
    "support": "floor",
    "defaultSize": {
      "w": 0.45,
      "d": 0.45,
      "h": 0.55
    },
    "mountHeight": null,
    "materialSlots": [
      "top",
      "legs"
    ],
    "faceSlot": null,
    "collisionExempt": false,
    "detectionPrompts": [
      "side table",
      "end table"
    ]
  },
  {
    "id": "console-table",
    "label": "Console Table",
    "group": "Tables & Desks",
    "support": "floor",
    "defaultSize": {
      "w": 1.2,
      "d": 0.35,
      "h": 0.78
    },
    "mountHeight": null,
    "materialSlots": [
      "top",
      "legs"
    ],
    "faceSlot": null,
    "collisionExempt": false,
    "detectionPrompts": [
      "console table",
      "hall table"
    ]
  },
  {
    "id": "dining-table",
    "label": "Dining Table",
    "group": "Tables & Desks",
    "support": "floor",
    "defaultSize": {
      "w": 1.8,
      "d": 0.9,
      "h": 0.75
    },
    "mountHeight": null,
    "materialSlots": [
      "top",
      "legs"
    ],
    "faceSlot": null,
    "collisionExempt": false,
    "detectionPrompts": [
      "dining table"
    ]
  },
  {
    "id": "nesting-tables",
    "label": "Nesting Tables",
    "group": "Tables & Desks",
    "support": "floor",
    "defaultSize": {
      "w": 0.55,
      "d": 0.55,
      "h": 0.5
    },
    "mountHeight": null,
    "materialSlots": [
      "top",
      "legs"
    ],
    "faceSlot": null,
    "collisionExempt": false,
    "detectionPrompts": [
      "nesting tables"
    ]
  },
  {
    "id": "desk",
    "label": "Desk",
    "group": "Tables & Desks",
    "support": "floor",
    "defaultSize": {
      "w": 1.4,
      "d": 0.7,
      "h": 0.75
    },
    "mountHeight": null,
    "materialSlots": [
      "top",
      "legs"
    ],
    "faceSlot": null,
    "collisionExempt": false,
    "detectionPrompts": [
      "desk",
      "writing desk",
      "computer desk"
    ]
  },
  {
    "id": "nightstand",
    "label": "Nightstand",
    "group": "Tables & Desks",
    "support": "floor",
    "defaultSize": {
      "w": 0.45,
      "d": 0.4,
      "h": 0.55
    },
    "mountHeight": null,
    "materialSlots": [
      "body",
      "handles"
    ],
    "faceSlot": null,
    "collisionExempt": false,
    "detectionPrompts": [
      "nightstand",
      "bedside table"
    ]
  },
  {
    "id": "vanity-table",
    "label": "Vanity Table",
    "group": "Tables & Desks",
    "support": "floor",
    "defaultSize": {
      "w": 1.1,
      "d": 0.45,
      "h": 0.78
    },
    "mountHeight": null,
    "materialSlots": [
      "top",
      "legs"
    ],
    "faceSlot": null,
    "collisionExempt": false,
    "detectionPrompts": [
      "vanity table",